{
  "schemaVersion": 1,
  "replayId": "replay_020",
  "artifactClass": "death_event_candidates",
  "sourceMethod": "normalized_death_counter_candidate_canonicalization",
  "generatedBy": "tools/emit-death-event-candidates.mjs",
  "generatedAt": "task_183",
  "rawDataCaptured": false,
  "fieldValuesCaptured": false,
  "rawTicksIncluded": false,
  "rawTimestampsIncluded": false,
  "finalFactsProduced": false,
  "gameplayInterpretationProduced": false,
  "attributionEmitted": false,
  "participantIdentityArtifactFound": true,
  "lifeStateTransitionArtifactFound": true,
  "candidateCount": 83,
  "candidates": [
    {
      "eventCandidateKey": "death_event_candidate_000001",
      "participantKey": "participant_10",
      "heroRefKey": "hero_ref_08",
      "teamRefKey": "team_ref_13",
      "normalizedElapsedSecond": 180,
      "sourceTransitionKey": "life_transition_000001",
      "sourceEvidenceType": "controller_death_counter_increment_candidate",
      "sourceObservationConfidence": "high",
      "confidenceMeaning": "confidence_in_source_counter_increment_observation_not_death_truth",
      "deathTruthStatus": "unconfirmed_candidate",
      "finalFact": false
    },
    {
      "eventCandidateKey": "death_event_candidate_000002",
      "participantKey": "participant_12",
      "heroRefKey": "hero_ref_10",
      "teamRefKey": "team_ref_13",
      "normalizedElapsedSecond": 189,
      "sourceTransitionKey": "life_transition_000002",
      "sourceEvidenceType": "controller_death_counter_increment_candidate",
      "sourceObservationConfidence": "high",
      "confidenceMeaning": "confidence_in_source_counter_increment_observation_not_death_truth",
      "deathTruthStatus": "unconfirmed_candidate",
      "finalFact": false
    },
    {
      "eventCandidateKey": "death_event_candidate_000003",
      "participantKey": "participant_07",
      "heroRefKey": "hero_ref_11",
      "teamRefKey": "team_ref_13",
      "normalizedElapsedSecond": 198,
      "sourceTransitionKey": "life_transition_000003",
      "sourceEvidenceType": "controller_death_counter_increment_candidate",
      "sourceObservationConfidence": "high",
      "confidenceMeaning": "confidence_in_source_counter_increment_observation_not_death_truth",
      "deathTruthStatus": "unconfirmed_candidate",
      "finalFact": false
    },
    {
      "eventCandidateKey": "death_event_candidate_000004",
      "participantKey": "participant_13",
      "heroRefKey": "hero_ref_05",
      "teamRefKey": "team_ref_13",
      "normalizedElapsedSecond": 217,
      "sourceTransitionKey": "life_transition_000004",
      "sourceEvidenceType": "controller_death_counter_increment_candidate",
      "sourceObservationConfidence": "high",
      "confidenceMeaning": "confidence_in_source_counter_increment_observation_not_death_truth",
      "deathTruthStatus": "unconfirmed_candidate",
      "finalFact": false
    },
    {
      "eventCandidateKey": "death_event_candidate_000005",
      "participantKey": "participant_02",
      "heroRefKey": "hero_ref_06",
      "teamRefKey": "team_ref_07",
      "normalizedElapsedSecond": 280,
      "sourceTransitionKey": "life_transition_000005",
      "sourceEvidenceType": "controller_death_counter_increment_candidate",
      "sourceObservationConfidence": "high",
      "confidenceMeaning": "confidence_in_source_counter_increment_observation_not_death_truth",
      "deathTruthStatus": "unconfirmed_candidate",
      "finalFact": false
    },
    {
      "eventCandidateKey": "death_event_candidate_000006",
      "participantKey": "participant_07",
      "heroRefKey": "hero_ref_11",
      "teamRefKey": "team_ref_13",
      "normalizedElapsedSecond": 323,
      "sourceTransitionKey": "life_transition_000006",
      "sourceEvidenceType": "controller_death_counter_increment_candidate",
      "sourceObservationConfidence": "high",
      "confidenceMeaning": "confidence_in_source_counter_increment_observation_not_death_truth",
      "deathTruthStatus": "unconfirmed_candidate",
      "finalFact": false
    },
    {
      "eventCandidateKey": "death_event_candidate_000007",
      "participantKey": "participant_10",
      "heroRefKey": "hero_ref_08",
      "teamRefKey": "team_ref_13",
      "normalizedElapsedSecond": 388,
      "sourceTransitionKey": "life_transition_000007",
      "sourceEvidenceType": "controller_death_counter_increment_candidate",
      "sourceObservationConfidence": "high",
      "confidenceMeaning": "confidence_in_source_counter_increment_observation_not_death_truth",
      "deathTruthStatus": "unconfirmed_candidate",
      "finalFact": false
    },
    {
      "eventCandidateKey": "death_event_candidate_000008",
      "participantKey": "participant_02",
      "heroRefKey": "hero_ref_06",
      "teamRefKey": "team_ref_07",
      "normalizedElapsedSecond": 389,
      "sourceTransitionKey": "life_transition_000008",
      "sourceEvidenceType": "controller_death_counter_increment_candidate",
      "sourceObservationConfidence": "high",
      "confidenceMeaning": "confidence_in_source_counter_increment_observation_not_death_truth",
      "deathTruthStatus": "unconfirmed_candidate",
      "finalFact": false
    },
    {
      "eventCandidateKey": "death_event_candidate_000009",
      "participantKey": "participant_09",
      "heroRefKey": "hero_ref_04",
      "teamRefKey": "team_ref_07",
      "normalizedElapsedSecond": 425,
      "sourceTransitionKey": "life_transition_000009",
      "sourceEvidenceType": "controller_death_counter_increment_candidate",
      "sourceObservationConfidence": "high",
      "confidenceMeaning": "confidence_in_source_counter_increment_observation_not_death_truth",
      "deathTruthStatus": "unconfirmed_candidate",
      "finalFact": false
    },
    {
      "eventCandidateKey": "death_event_candidate_000010",
      "participantKey": "participant_11",
      "heroRefKey": "hero_ref_13",
      "teamRefKey": "team_ref_13",
      "normalizedElapsedSecond": 474,
      "sourceTransitionKey": "life_transition_000010",
      "sourceEvidenceType": "controller_death_counter_increment_candidate",
      "sourceObservationConfidence": "high",
      "confidenceMeaning": "confidence_in_source_counter_increment_observation_not_death_truth",
      "deathTruthStatus": "unconfirmed_candidate",
      "finalFact": false
    },
    {
      "eventCandidateKey": "death_event_candidate_000011",
      "participantKey": "participant_06",
      "heroRefKey": "hero_ref_03",
      "teamRefKey": "team_ref_13",
      "normalizedElapsedSecond": 475,
      "sourceTransitionKey": "life_transition_000011",
      "sourceEvidenceType": "controller_death_counter_increment_candidate",
      "sourceObservationConfidence": "high",
      "confidenceMeaning": "confidence_in_source_counter_increment_observation_not_death_truth",
      "deathTruthStatus": "unconfirmed_candidate",
      "finalFact": false
    },
    {
      "eventCandidateKey": "death_event_candidate_000012",
      "participantKey": "participant_04",
      "heroRefKey": "hero_ref_12",
      "teamRefKey": "team_ref_07",
      "normalizedElapsedSecond": 513,
      "sourceTransitionKey": "life_transition_000012",
      "sourceEvidenceType": "controller_death_counter_increment_candidate",
      "sourceObservationConfidence": "high",
      "confidenceMeaning": "confidence_in_source_counter_increment_observation_not_death_truth",
      "deathTruthStatus": "unconfirmed_candidate",
      "finalFact": false
    },
    {
      "eventCandidateKey": "death_event_candidate_000013",
      "participantKey": "participant_02",
      "heroRefKey": "hero_ref_06",
      "teamRefKey": "team_ref_07",
      "normalizedElapsedSecond": 519,
      "sourceTransitionKey": "life_transition_000013",
      "sourceEvidenceType": "controller_death_counter_increment_candidate",
      "sourceObservationConfidence": "high",
      "confidenceMeaning": "confidence_in_source_counter_increment_observation_not_death_truth",
      "deathTruthStatus": "unconfirmed_candidate",
      "finalFact": false
    },
    {
      "eventCandidateKey": "death_event_candidate_000014",
      "participantKey": "participant_04",
      "heroRefKey": "hero_ref_12",
      "teamRefKey": "team_ref_07",
      "normalizedElapsedSecond": 586,
      "sourceTransitionKey": "life_transition_000014",
      "sourceEvidenceType": "controller_death_counter_increment_candidate",
      "sourceObservationConfidence": "high",
      "confidenceMeaning": "confidence_in_source_counter_increment_observation_not_death_truth",
      "deathTruthStatus": "unconfirmed_candidate",
      "finalFact": false
    },
    {
      "eventCandidateKey": "death_event_candidate_000015",
      "participantKey": "participant_12",
      "heroRefKey": "hero_ref_10",
      "teamRefKey": "team_ref_13",
      "normalizedElapsedSecond": 613,
      "sourceTransitionKey": "life_transition_000015",
      "sourceEvidenceType": "controller_death_counter_increment_candidate",
      "sourceObservationConfidence": "high",
      "confidenceMeaning": "confidence_in_source_counter_increment_observation_not_death_truth",
      "deathTruthStatus": "unconfirmed_candidate",
      "finalFact": false
    },
    {
      "eventCandidateKey": "death_event_candidate_000016",
      "participantKey": "participant_11",
      "heroRefKey": "hero_ref_13",
      "teamRefKey": "team_ref_13",
      "normalizedElapsedSecond": 626,
      "sourceTransitionKey": "life_transition_000016",
      "sourceEvidenceType": "controller_death_counter_increment_candidate",
      "sourceObservationConfidence": "high",
      "confidenceMeaning": "confidence_in_source_counter_increment_observation_not_death_truth",
      "deathTruthStatus": "unconfirmed_candidate",
      "finalFact": false
    },
    {
      "eventCandidateKey": "death_event_candidate_000017",
      "participantKey": "participant_10",
      "heroRefKey": "hero_ref_08",
      "teamRefKey": "team_ref_13",
      "normalizedElapsedSecond": 646,